{"name":"wiz-inspector","version":"0.1.0","description":"GRC connector for Wiz CNAPP: normalizes configuration findings, issues, vulnerabilities, and cloud resource inventory into v1 Findings.","author":{"name":"GRC Engineering Club Contributors"},"license":"MIT","repository":"https://github.com/GRCEngClub/claude-grc-engineering","keywords":["grc","compliance","wiz","cnapp","cloud","vulnerability","scf","connector"]}
