{"name":"snowflake-inspector","version":"0.1.0","description":"GRC connector for Snowflake ACCOUNT_USAGE: evaluates MFA, network policies, masking/row access policies, session timeout, and data retention. Emits findings conforming to schemas/finding.schema.json v1.","author":{"name":"GRC Engineering Club Contributors"},"license":"MIT","repository":"https://github.com/GRCEngClub/claude-grc-engineering","keywords":["grc","compliance","snowflake","data","warehouse","scf","connector"]}
