{
  "name": "grc-diagrams",
  "description": "Editable draw.io diagram skills for GRC system boundaries, evidence flows, control maps, risks, audits, crosswalks, TPRM, POA&M, data flows, RACI, and operating models.",
  "version": "0.1.0",
  "author": {
    "name": "GRC Engineering Club Contributors"
  },
  "repository": "https://github.com/GRCEngClub/claude-grc-engineering",
  "license": "MIT",
  "keywords": [
    "grc",
    "drawio",
    "diagrams",
    "compliance",
    "audit",
    "risk",
    "controls"
  ]
}
