{
  "name": "crowdstrike-inspector",
  "version": "0.1.0",
  "description": "GRC connector for CrowdStrike Falcon: evaluates sensor coverage, detection/prevention policy visibility, and host-group scoping. Emits findings conforming to schemas/finding.schema.json v1.",
  "author": { "name": "GRC Engineering Club Contributors" },
  "license": "MIT",
  "repository": "https://github.com/GRCEngClub/claude-grc-engineering",
  "keywords": ["grc", "compliance", "crowdstrike", "falcon", "endpoint", "scf", "connector"]
}
