{
  "name": "datadog-inspector",
  "version": "0.1.0",
  "description": "GRC connector for Datadog: evaluates log retention, audit log coverage, monitor coverage, SSO visibility, and RBAC roles. Emits findings conforming to schemas/finding.schema.json v1.",
  "author": { "name": "GRC Engineering Club Contributors" },
  "license": "MIT",
  "repository": "https://github.com/GRCEngClub/claude-grc-engineering",
  "keywords": ["grc", "compliance", "datadog", "monitoring", "logs", "scf", "connector"]
}
