{
  "name": "slack-inspector",
  "version": "0.1.0",
  "description": "GRC connector for Slack: evaluates workspace 2FA, SSO/session posture, retention, app approvals, and DLP visibility. Emits findings conforming to schemas/finding.schema.json v1.",
  "author": { "name": "GRC Engineering Club Contributors" },
  "license": "MIT",
  "repository": "https://github.com/GRCEngClub/claude-grc-engineering",
  "keywords": ["grc", "compliance", "slack", "collaboration", "scf", "connector"]
}
