{"name":"tenable-inspector","version":"0.1.0","description":"GRC connector for Tenable.io/Tenable.sc: evaluates scan coverage, credentialed scan signals, vulnerability age, and scan access visibility. Emits findings conforming to schemas/finding.schema.json v1.","author":{"name":"GRC Engineering Club Contributors"},"license":"MIT","repository":"https://github.com/GRCEngClub/claude-grc-engineering","keywords":["grc","compliance","tenable","vulnerability","scanner","scf","connector"]}
